{
  "schema_version": 1,
  "edge_id": "grp6-edge",
  "batch_id": "replay-anomaly-batch-001",
  "sent_at": "2026-09-19T05:30:02.000Z",
  "events": [
    {
      "event_id": "replay-evidence-site-1",
      "type": "evidence",
      "source_mode": "replay",
      "run_id": "REPLAY-RUN-001",
      "tester_id": "grp6-replay",
      "lot_id": "REPLAY-LOT",
      "wafer_id": "14",
      "site_id": 1,
      "timestamp": "2026-09-19T05:30:00.000Z",
      "sequence": 41,
      "evidence_id": "evidence-replay-site-1",
      "incident_id": "incident-replay-mean-drift",
      "kind": "mean_drift_up",
      "sample_count": 24,
      "current_value": 1.42,
      "baseline": 1.08,
      "score": 3.8,
      "affected_tests": ["Main.demo#P1"],
      "series": [1.07, 1.08, 1.12, 1.19, 1.31, 1.42],
      "severity": "warning",
      "message": "Site 1 mean increased relative to replay baseline.",
      "data_quality": "complete"
    },
    {
      "event_id": "replay-evidence-site-2",
      "type": "evidence",
      "source_mode": "replay",
      "run_id": "REPLAY-RUN-001",
      "tester_id": "grp6-replay",
      "lot_id": "REPLAY-LOT",
      "wafer_id": "14",
      "site_id": 2,
      "timestamp": "2026-09-19T05:30:01.000Z",
      "sequence": 42,
      "evidence_id": "evidence-replay-site-2",
      "incident_id": "incident-replay-mean-drift",
      "kind": "mean_drift_up",
      "sample_count": 24,
      "current_value": 1.11,
      "baseline": 1.07,
      "score": 0.7,
      "affected_tests": ["Main.demo#P1"],
      "series": [1.06, 1.07, 1.08, 1.09, 1.10, 1.11],
      "severity": "warning",
      "message": "Site 2 remains near the replay baseline.",
      "data_quality": "complete"
    }
  ]
}
